"product_name","source","id","Reviewer","Rating","Title","Date","Body","Number","image_urls"
"product1","all review","137","The Dude","2.0 out of 5 stars","Too big for my ears","Reviewed in the United States on June 27, 2023","The reviews were great and I needed a replacement for my Air Pods that stopped charging/connecting to my phone. I didn't want to pay that much again when there are so many options, so I tried these. From the first day, I wasn't a fan. They are too big for my ear canals and slowly work their way out as I wear them, meaning I'm constantly having to adjust them. Which is annoying if I'm doing something that prevents me from adjusting (cooking) and means that they shut off the second I touch them, requiring me to restart whatever I'm listening to. Which is crazy because sometimes when they fall out/I take them out, they keep playing even though they're no longer in my ears. I don't get it. Worse is that they are super sensitive to wind. I like to walk outside to get in my steps, and if it's at all windy, they cut in and out the entire time. So much that there have been a couple times they've gotten out of synch and I'm listening to my audiobook in stereo. It's awful. I wore them on the airplane on the way back from vacation hoping I could get some sleep, and my ears hurt so bad by the time we landed that for the next flight I just took out my corded ear phones.I've only had them for a little over two weeks and I've already ordered a different pair because I hate these so much.The only good thing? One worked its way out of my ear while I was cleaning my pool and fell in, and it took me a few minutes to find it. It still works! Which is insane. So they're waterproof and maybe if you have bigger ear canals and don't want to walk in the wind they'll be okay, but for me, these did not work at all.","2",""
"product1","all review","138","Cameron Baird","2.0 out of 5 stars","Great for about 3 months","Reviewed in the United States on June 24, 2023","First and foremost, these earbuds have great audio quality and resonance, as well as sound buffering to neutralize outside noise. These are the pros, however the cons certainly outweigh them.In terms of UI, the touch-control doesn’t seem to have any sense of designation - meaning that if you brush against the earbuds, readjust them, or even simply hold them to converse with somebody - they will acknowledge this as an attempt to either change song, adjust volume, start/stop music, etc.This isn’t the crux of the issue, though.The key issue with these earbuds is the charging case malfunctioning. Maybe I have a defective set, maybe it’s an industry setting fault. When you place the earbuds into the charging case it charges the ear pieces (hence the name, obviously), and it displays for the user when one bud is finished charging. Sounds great and would be a fantastic tool, and it worked as described for the initial 3 months; however, after this period the right earbud seems to need continuous charging. I’ll see it displayed on the exterior of the charging case and it will continue to do so until the case itself is out of power, at which point it is more or less defunct. This issue takes about 12-24hours to drain the battery. Now, this is not a huge problem given the time frame, but I have to keep it on the charger at all times, which defeats the purpose of the charging case.I have tried everything from cleaning both the earbuds and the case, thoroughly, adjusting the metallic charging prongs to ensure one is not jammed, etc., but all to no avail.Good product, but certainly better products out there. Should mine simply be defective, then I would rate this a 4 star product given the UI issues.","2",""
"product1","all review","139","Michelle Williams","2.0 out of 5 stars","Cute, but battery dies very quickly.","Reviewed in the United States on October 20, 2023","I bought these to replace my first identical pair that I ordered and received last week because I had misplaced a different pair that worked wonderfully. When the battery ran down quickly, I found my original earbuds and processed a return. I was given the option to get a new pair or a refund, and decided that maybe the new pair would work better.The reviews I had read boasted that the battery life for this model was long and that they also had q good and clear mouthpiece. I recieved this pair yesterday and waited until this morning to open the package and make sure I charged them and the battery pack before I used them. The battery pack went from “100%” to “70%” and then back up to “100%” as it was connected to a power source. I took the earbuds out and carried them around the house for the day, but only used them for a couple of phone calls. Then, this evening I put them on to listen to an audiobook. About 30 minutes in, the prompt “The battery needs to be charged” started and repeated itself in a couple of minutes. I'm sending this set back as well. Disappointing!","2",""
"product1","all review","140","Callie","4.0 out of 5 stars","Good for the price","Reviewed in the United States on January 14, 2024","Good for the price, however there are SOME issues.If you have tiny or sensitive ears, these are not comfortable. I'm unfortunately unable to wear them for periods longer than 40-ish minutes due to how paiful they are to wear. This is just an issue with my ears, but if you are like me and you are determined to get these, wear them upside down. It's significantly less painful.The audio is loud. Even on the lowest setting, these things are pretty loud. I have autism and when im having a sensory overload, the lowest settings of these are very painful. Wholeheartedly recommend using these with an app like spotify where it allows you to lower the volume further via the app.The touch sensors on the side are SO SENSITIVE. My hair manages to trigger them, yet when I actually want to skip a song or pause and play my music, it doesn't work to well and can lead to some frustration.The audio quality itself seems okay. It's definitely not like my more expensive over-the-ear headphones, but it isn't grating or awful. I don't use these for calls,  so I'm not too sure about the mic quality.Battery life is pretty nice, the overall feel of the earbuds in my hands are nice also. The case feels a little cheap on the outside, but not to the point where I feel like the lid is going to break off. Just be careful not to drop them.I like the color and appearance of them! They look exactly like the picture. I haven't had any issues with the case or charging, but please be aware when you first turn it all on, the case battery is going to drop very quickly to charge the headphones.The earbuds come with a lifetime warranty you can activate for free. I reached out to customer support regarding a question, and they replied within the next business day and were very helpful.TL;DR:Hurts tiny ears, loud minimum audio, touch gestures kinda suck... buuutttt audio itself good for the price, the earbuds come with a free lifetime warranty, battery life is nice, they look exactly as advertised, customer service is quick and efficient.Overall 4/5⭐️","4",""
"product1","all review","141","David Kim","4.0 out of 5 stars","GREAT build quality, BUT .... (UPDATED: Excellent Customer Service!)","Reviewed in the United States on February 18, 2024","(UPDATE: Right after expressing my concerns with the sound quality, customer service reached out to see how they could help! I added a star because it's REFRESHING when customer service is actually great!)... it's got issues.At the time of writing, I'm writing this review, mostly because this product has SO much promise, but it has two issues that left me disappointed. Also, for preface, I'm a filmmaker who also makes music, so I'd say I have a good ear for sound.First, the good: The build quality is EXCELLENT, especially for the price! It's a bit bigger than some competitors, but it's really light and well-made. The screen is helpful, and the earbuds themselves feel solid. Bluetooth connectivity is straightforward as well!Now, onto my critiques: A smaller one, but still important, but the noise cancelling just doesn't work on this. While it does a good job blocking out sound, I've had friends and family members complain about my microphone when calling. The product actually lists that it has some sort of noise canceling for calls, but it's nothing really special.But that's not my biggest problem.It's just the sound is SO off! Some people might be able to get used to it, but I can't. It was really shocking because the first impressions were great, and I don't get why so many people have reviewed this so positively. As someone who listens to a wide range of music (hip hop, rock, pop, even traditional East Asian music!), the earbuds do a poor job of outputting a clear sound. The mix is REALLY muddy, especially at the low frequencies. Basses really mess up male vocals, and high frequencies are airy. The mids seem completely missing, almost like the inverse of what you'd hear through a phone!If they can just adjust their EQ to sound fuller (and maybe tone down the bass), then these would be INCREDIBLE. Again, I'm SHOCKED that this has as many positive reviews. I'd rather buy $8 wired earbuds over these. This product has HUGE POTENTIAL, but completely WASTED buy the actual sound quality.(And no, I will not be downloading EQ's specifically for these earbuds. I have too many devices)The Tozo T6 (my previous earbuds) are a great alt at this price point (whenever it's on sale at least), but since I wanted to try something new, I'm sticking with the JBL Vibes. They sound great :)","4",""
"product1","all review","142","Ohad","4.0 out of 5 stars","Price so good...sound so bad","Reviewed in the United States on March 7, 2024","For $35? These are incredible. I'm planning on buying 2 or 3 more to give as gifts. The interchangeable ear cups let you customize the fit and the little screen on the case that shows the battery level is nifty--Apple should have this feature. Since you can buy three of these for the cost of only one pair of the basic Airpods--they're awesome. The sound quality is just terrible! I found that changing the EQ settings on my iPhone helps a bit depending on the type of music you are listening to. These don't noise cancel at all.  They feel cheap. The plastic on the case is rough--not smooth like Airpods. The case is flimsy. I'm worried that flipping it open and shut often could lead to it breaking. The earbuds themselves are so light in your hand--very easy to drop. I'm confident these will work great for what I bought them for--listening to music in the gym and podcasts while I'm folding laundry--and I built that assumption into my purchase--I didn't expect great sound. If you're settling in to really listen to music and drown out noise in a coffee shop, these are not for that.","4",""
"product1","all review","143","Amazon Customer","4.0 out of 5 stars","Good quality","Reviewed in the United States on February 21, 2024","I ordered these earphones yesterday after I spent some time reading the reviews. I was a bit scepitable due to the price and some of the reviews. They were delivered the same day I ordered them. I opened the box to find them 100% charged! I put them in my ears fit was great and I can walk and move without them falling out of my ears. It was an easy set up with my Samsung s10. I haven't utilized any of the buttons yet. I tried the volume today per the booklet, but was unable to get it to work. I find it easier to use the phone volume button. I don't plan to use these for calls only music. I find the music quality = in both ears. I went out in my backyard and was able to walk freely without losing the connection. I left the phone in the house and was able to get about 25 ft until it wasn't commuicating with the phone. I was digging up some small tree roots and the earpieces remained in except once. It loosened in my ear and when i pressed it back in it stopped the music. Me not wanting to figit with the button to figure it out I chose to walk to my phone. In the coming days I will explore the buttons, but not today.","4",""
"product1","all review","144","Ashlyn V.","4.0 out of 5 stars","May as well be Michael Phelps","Reviewed in the United States on March 1, 2024","Comfort: 5/10Sound Quality: 6/10Convenience: 8/10I kind of hated these when I first bought them because they weren’t the best in comfort or sound quality but used them because $40 is $40.However, they’re powered by like…. Idk radioactive rabbits or something. They charge super fast and the charge lasts around at least 7 business days.But also, they are truly truly water proof. How do I know? Because I’m a mom of a nasty lil 9yo and a potty training 2yo and LAUNDRY is taking over my house. I pretty much just load up the forklift, drop the clothes in, and have a fun lil scavenger hunt after the clothes come out. These sweet lil headphones didn’t deserve to go through the washer with my kids crap stains and half eaten suckers, but they did. And they came out of the washer as if they hadn’t just been traumatized.Props.","4",""
"product1","all review","145","Odell R.","4.0 out of 5 stars","Sounds good!","Reviewed in the United States on March 14, 2024","The earbuds were delivered quickly in a nice box, reminiscent of Apple packaging. The instructions were straightforward and concise. The earbuds fit very well into a nice carrying case that includes a battery indicator for the case as well as indicators that the earbuds are charging. The case has kept a good charge and has only been charged once since I got them. However, I only use the earbuds for a short time every day at this point.The only problem I have with the earbuds is that it’s difficult to determine where exactly to tap to change volume, track, answer my phone, etc. I think that will work itself out as I use them more.","4",""
"product1","all review","146","alan","4.0 out of 5 stars","Falls out. Good sound and battery life","Reviewed in the United States on January 21, 2024","Moved on to these after old airpods not keeping charge. They're a lot bigger. They tend to fall out of my ears when I talk, bend down, chew or move rapidly. When I adjust the placement while wearing them they turn off the audio or switch tracks, but I cannot seem to get the hang of changing tracks or turning off the audio etc while they're in. My ear did get sore where the earbud changes size from small inner ear portion to the larger portion that hangs out of the ear. They tend to build up moisture in the ear canal. Not that it's unbearable but it's a different experience and I'll have to be diligent in keeping the earbuds super clean.The sound is good. They're not completely noise cancelling which is good for my needs. I have not tried them in very noisy environments though.The microphone is good for calls but voice to text seems to have difficulties. It could be an issue with something I'm doing but it's an issue I'm having nonetheless.The battery life is surprisingly good. I like the fact that the battery life is shown on the outer case. No guessing when you might need to charge it.The case is a bit bigger than I expected but it's easier to find when it wants to fall to the bottom of a bag or backpack.","4",""
"product1","all review","147","Schwindjr","4.0 out of 5 stars","Best backup set I've owned","Reviewed in the United States on March 6, 2024","I've tried dozens of bluetooth earbuds; brands and styles, cheap and expensive.  I don't need tons of features, but I do need earbuds that don't fall out when working out.  My Anker Soundcore X10 are my go-to @ $70.  But these TAGRY earbuds are half the price, connect easy, have a long charge, and DON'T fall out of my ears.  If I could give a star rating for ""fit"" it would be a 5.  Make no mistake, this set does not have active noise cancelling or really dynamic clear sound.  They work and they stay in my ear at the gym.  Great find at this price point.","4",""
"product1","all review","148","Amazon User","4.0 out of 5 stars","Great headphones for the price","Reviewed in the United States on March 11, 2024","These are great, reliable headphones for the price.  Easy to connect, audio sounds great.  When comparing to the Apple Airpods, however, the only drawback is that after wearing them for over an hour, they are not as comfortable as the Airpods.  There is an indescribable comfort with the Apple Airpods - you almost forget you're wearing them.  I've tried several different sizes of the silicone caps, however, no matter the size - over time, they are not comfortable.","4",""
"product1","all review","149","Momnurse","4.0 out of 5 stars","Great battery life, but too loud","Reviewed in the United States on February 8, 2024","I bought these to listen to audible while going to sleep. I like to listen to stories to lull me to sleep. My headphones hurt my ears, so I wanted something small that would be more comfortable to sleep. I disliked that these were way too loud on the lowest setting. The volume on the lowest setting is like a medium setting.They are comfortable and I decided to use them for walking in my neighborhood instead. They block out car noise, so I am able to still use them. I got them on sale around Christmas. I like the pink color. The battery life is good, about 6 hours, then you can put them back in the rechargeable case and get several more 6 HR charges from one charge from the case. I think around 40 to 60 hrs in total. Would recommend if you don't mind loud ear buds.","4",""
"product1","top review","0","Heather Langston","5.0 out of 5 stars","Dare I say it?","Reviewed in the United States on March 24, 2024","I bought these in September of 2023 as a back up for for when my AirPods died. I enjoy listening to audio books as I clean and do chores. Well, today, I realized I couldn’t remember what in the world I’d done with them after my AirPods died. Hours later, I found them in the bottom of my washing machine. I left them in my pants pocket. I just knew they were ruined. Well, they still work perfectly. Even my husband was amazed. My only complaint about them is I wish I could locate them like my AirPods. I love these and dare I say it? I like them better than my AirPods!! They stay charged for a long time, and charge the same as the Apple ones. I’ve decided I need another pair! 🥰","5",""
"product1","top review","1","Sara Slick","5.0 out of 5 stars","Crisp, clear and comfy","Reviewed in the United States on March 18, 2024","First off this is my very first pair of these kind of ear buds, and I am impressed… They’re comfortable which I was nervous about because a lot of the older buds (the ones that came with iPhone) never fit my ears right. I have small ear holes or something. The first song I chose to listen to was Bottle and Mary Jane by Jelly Roll. It sounds great! I paid less than $30 and I gotta say they’re worth every penny. I cannot compare them to more expensive buds because I’ve not used them.  But these are perfect for me because I won’t be  using them much. I don’t care about name brands or having the product of the moment. If they don’t last or if I start having issues I will update this, as I just got these 2 days ago.","5",""
"product1","top review","2","Ohad","4.0 out of 5 stars","Price so good...sound so bad","Reviewed in the United States on March 7, 2024","For $35? These are incredible. I'm planning on buying 2 or 3 more to give as gifts. The interchangeable ear cups let you customize the fit and the little screen on the case that shows the battery level is nifty--Apple should have this feature. Since you can buy three of these for the cost of only one pair of the basic Airpods--they're awesome. The sound quality is just terrible! I found that changing the EQ settings on my iPhone helps a bit depending on the type of music you are listening to. These don't noise cancel at all.  They feel cheap. The plastic on the case is rough--not smooth like Airpods. The case is flimsy. I'm worried that flipping it open and shut often could lead to it breaking. The earbuds themselves are so light in your hand--very easy to drop. I'm confident these will work great for what I bought them for--listening to music in the gym and podcasts while I'm folding laundry--and I built that assumption into my purchase--I didn't expect great sound. If you're settling in to really listen to music and drown out noise in a coffee shop, these are not for that.","4",""
"product1","top review","3","Amazon Customer","4.0 out of 5 stars","Good quality","Reviewed in the United States on February 21, 2024","I ordered these earphones yesterday after I spent some time reading the reviews. I was a bit scepitable due to the price and some of the reviews. They were delivered the same day I ordered them. I opened the box to find them 100% charged! I put them in my ears fit was great and I can walk and move without them falling out of my ears. It was an easy set up with my Samsung s10. I haven't utilized any of the buttons yet. I tried the volume today per the booklet, but was unable to get it to work. I find it easier to use the phone volume button. I don't plan to use these for calls only music. I find the music quality = in both ears. I went out in my backyard and was able to walk freely without losing the connection. I left the phone in the house and was able to get about 25 ft until it wasn't commuicating with the phone. I was digging up some small tree roots and the earpieces remained in except once. It loosened in my ear and when i pressed it back in it stopped the music. Me not wanting to figit with the button to figure it out I chose to walk to my phone. In the coming days I will explore the buttons, but not today.","4",""
"product1","top review","4","Kimberly Norman","5.0 out of 5 stars","Solid product!","Reviewed in the United States on March 23, 2024","I almost never write reviews, but felt I had to after hubby accidentally washed the charging case a couple of days ago, and it still works fine. I know it SAYS waterproof, but products make a lot of claims. Turns out this one is true. These are great, reliable little earbuds. Not as many features as AirPod Pros, (like, no noise canceling feature like the AirPods) but since at least ONE of those dang Airpods stops working routinely for seemingly no reason -- CERTAINLY nothing as injurious as being laundered!-- the noise canceling feature doesn't work anyway when only one Airpod is working. These are much more reliable, and about 1/10th the cost. Great producdt!","5",""
"product1","top review","5","jules","4.0 out of 5 stars","Good value","Reviewed in the United States on March 25, 2024","These sound great, I've had no issues so far. They fit well, have been comfortable, seem to have a long battery life, so I'd say they're a pretty good value for the price. The only thing that bugs me, that none of the reviews I've read mentioned, is that these do not stand up - as suggested by the description photos. It doesn't make or break them, it just bugs me. Not one side is completely flat so they are prone to move around no matter how you set them... Front or back, they can be spun around, top bottom and sides are too rounded to ""stand"" on. Charging port is on  what I would call the ""bottom"", based off of how the ""top"" opens.","4","61tQkNaR8rL._SY88.jpg"
"product1","top review","6","YI","5.0 out of 5 stars","Budget-Friendly and Durable","Reviewed in the United States on March 16, 2024","I opted for these Bluetooth headphones instead of splurging on AirPods, fearing I'd inevitably lose them—and guess what? I haven't lost them yet! Surprisingly, these headphones have exceeded my expectations in terms of both quality and durability.I was pleasantly surprised by the sound quality and overall performance of this product, especially considering its affordable price point. But the real shocker came when I accidentally ran one of the headphones through the washer. Despite the mishap, it continued to work perfectly fine afterward!This experience has reaffirmed my belief that you don't need to spend a fortune on Apple products to get a reliable pair of headphones. These Bluetooth headphones are proof that quality and durability can come at an affordable price. Don't hesitate to give them a try!Overall Rating: ⭐️⭐️⭐️⭐️⭐️","5",""
"product1","top review","7","Dynae Saba","5.0 out of 5 stars","These are EXACTLY WHAT I NEEDED!","Reviewed in the United States on February 28, 2024","My expensive pair of Air Pods fell in half right after the warranty expired. I no longer had a desire to pay for mediocre headphones that loss their effectiveness more and more overtime. I ordered two low cost headphones on amazon (this pair being the first to be delivered) and I couldn't be happier! These fit perfectly in my ears (I have sensitive ears that will ache over an extended period of time of wearing headphones...Not with these!!! ). The sound quality if superb and I don't ever have them turned up full blast as they're really loud. I utilize them to listen to audio books and podcasts for 8 hours at work and they've never died. I use one at a time and I don't even need to switch sides within those 8 hours. I charged the case the day I received them and that was a week and a half ago and I still haven't recharged them. Talking on the phone voice clarity is great and I have had no issues. Connectivity is easy and consistent. These will be my go to!","5",""
