"product_name","source","id","Reviewer","Rating","Title","Date","Body","Number","image_urls"
"product1","all review","0","Ana","2.0 out of 5 stars","Not worth it","Reviewed in the United States on December 2, 2023","I got this for a heavy black friday discount and had high hopes. But ti really wasnt worth it for me.They stay in my ears until i laugh, chew, or im doing a workout. And then im fighting to keep them in my ear until I find the exact spot they sit comfortaby.And then if im constantly adjusting, my fingers hit the button no matter how i hold the earbuds. And of course when I want them to register my finger input, im pressing 3-4 times for it to notice. And then if im double tapping to skip to the next song, it only registers the first one and then pauses the music.Long story Short,im returning these. If you have a lot of patience, then get these. If not, i recommend getting ones that are smaller/sit in the ear better","2",""
"product1","all review","1","Chelsea Morehead","2.0 out of 5 stars","PAINFUL","Reviewed in the United States on March 9, 2024","I’ve tried to wear these for days hoping my ears just needed to get used to them but they’re not. Nobody mentioned how terribly uncomfortable and painful these were in the reviews. I’ve tried wearing them with and without the ear tips and they’re still extremely uncomfortable and painful. I will be returning them.","2",""
"product1","all review","2","Amber","2.0 out of 5 stars","Ear buds are painful!!","Reviewed in the United States on January 9, 2024","I like everything about these Barbuda except that they are incredibly painful to wear! I've tried all 3 sizes provided (horribly smashed, btw) and all 3 cause extreme pain. I've had to use a pair from an old set which provides slight comfort but only for a limited time. I cannot wear these for more than 10 mins without extreme ear pain. It feels like there's a plastic seam that just rubs the inside of the ear and it hurts! If I can't figure out a solution, I will have to return these. Very disappointed 😞","2",""
"product1","all review","3","Mikaela","2.0 out of 5 stars","Not as very good as the reviews made them out to be","Reviewed in the United States on February 7, 2023","The aesthetic of the earbuds is pretty nice, I enjoy the color and sleekness to it and think its overall visual design isn't bad at all. I especially like how you can see the battery life of the earbuds, which was the feature I was most attracted to, but that's really where my compliments end, and the only reason why I bothered giving an extra star.The earbuds are pretty uncomfortable if you have smaller ears. They feel tight and overly stiff and will make your ears feel on the sore side with extended use. Which is a shame, because again, visually, they look quite nice. They come off quite easily in my experience, so working out and running wouldn't be the best use of these headphones. It doesn't feel secure at all to my ears, but it could also simply be because they don't fit smaller ears in general too well.Secondly, the sound quality isn't very good at all. It sounds muffled and cheap, not something worth around a $30 price point. If you're not someone who cares about sound quality and just want a working pair of wireless earbuds that get the job done though, and you don't mind the muffled-ness, I can see this being a decent pair of headphones for you.Thirdly, I noticed pretty quickly, almost immediately actually, that the battery drains rather quickly. Not even a full 3-5 minutes had passed before it dropped 5%, which may not sound like a lot, but compared to other wireless headphones I've used its rather quick. Even now it's dropped 10% in 10 minutes and I haven't even used/touched it in that time.Overall, I think it's better to find a better pair of earbuds for half the price because there are much better options out there. For the price point, it isn't worth it, and I'm pretty disappointed considering all of the positive reviews.","2",""
"product1","all review","4","Anonymous","2.0 out of 5 stars","Earbuds That Fail At Being Earbuds","Reviewed in the United States on February 2, 2024","The worst pair of earbuds I've gotten outside of the kind of convenience stores that have sticky floors and a vague smell of malaise.The audio quality listening to music was meh.  On phone calls, no one could understand me because the microphone volume would go in and out.  Even wearing a properly fitted rubber tip, they don't stay in your ears.  I had mine for less than 48 hours before one fell out and immediately ran off to the magical land that your ballpoint pens and socks disappear to.","2",""
"product1","all review","5","AmazonReviewer","2.0 out of 5 stars","Not good for audiobooks","Reviewed in the United States on April 25, 2023","I use headphones primarily for audiobooks (and phone calls if someone calls while I’m listening to one). I can’t speak for the call quality because I listened for 2 minutes before deciding to return these. There is an ever-present background noise/static in these earbuds. I have really good hearing (probably to make up for my crappy eyesight lol), so maybe not everyone can hear it, but it is extremely noticeable and distracting to me when listening to audiobooks.As a test, I tried a short YouTube video and didn’t notice it as much (there is constant music/talking in most videos that mostly drowns out the static noise). But for audiobooks where the sound is just one person’s voice+pauses while they narrate, these are not the earbuds for that.My previous earbuds (that had great sound quality for the same price) were broken accidentally and that earbud brand is no longer available on Amazon, so I tried these after reading the good reviews. Bummer that they didn’t work out. My journey to find a suitable replacement continues.Giving the product 2 stars instead of 1 because their warranty is lifetime, even if lost, which I don’t see offered often. Also comes with a (very short) charging cord (my last pair did not come with one) and multiple rubber cone sizes for your ears. The shipping was extremely fast (same day) and the color options are cute. So two stars for those things, but with the sound quality being what it is (on audiobooks especially), I can’t say it “meets expectations” as one would expect from a 3 star rating.","2",""
"product1","all review","6","Kimberly","2.0 out of 5 stars","Keeps Falling Out","Reviewed in the United States on January 5, 2024","My husband and I have a different sleep cycle and I get up way early.  I purchased these so that I could listen to TV and do quiet stuff around the house without waking him.  No matter what I do, these ear buds keep falling out.  I've tried all the different sizes and the only way these stay in my ears is to not move.  Anytime I get up to do anything they fall out.  If they stayed in I would like them much better.","2",""
"product1","all review","7","Bertram Krueger","2.0 out of 5 stars","Even on sale, it wasn't worth it.","Reviewed in the United States on January 30, 2024","I got these on sale since I needed a quick replacement pair of earbuds. They didn't fit in my ears nearly as well as I'd hoped. The buttons on the side for pausing/unpausing were awkward to use from a lack of a physical button and a solid 2.5 second delay between input and response. The audio quality was also very poor, with songs sounding muffled and fuzzy like they were coming from the other side of a wall late at night. At least the battery life is good.","2",""
"product1","all review","8","Bill Petrie","2.0 out of 5 stars","Garbage.","Reviewed in the United States on February 25, 2024","I’m giving this two stars because the connection process was easy. Once connected, these were a severe disappointment from a sound perspective. I’d rather listen to my music on a 1970s era transistor radio as it would have more bass. I got wooed by the price and got burned.","2",""
"product1","all review","9","MarshWalker","2.0 out of 5 stars","Controls have very poor response","Reviewed in the United States on March 5, 2024","I'm constantly having to tap, tap, try again, hold my finger down, try tapping again... once in a while it works, but if I'm driving and need to answer a call this is NOT going to work. It's very frustrating just watching videos! The sound has little bass. Returning.","2",""
"product1","all review","10","Veronica Dixon","4.0 out of 5 stars","Great Earbuds!","Reviewed in the United States on March 11, 2024","These are amazing - especially for the price. I can easily take calls on my phone, or my computer. Listen to music while I'm out and about. I fly a lot for work and these earbuds are comfortable. The only reason I gave it 4 stars is because I have super small ears. Even with the smallest silicone inserts, they get pushed out of my ears after about 45 minutes of use. For longer durations, I just use my over-the-head headphones which I prefer anyway. But these are wonderful!","4",""
"product1","all review","11","Bingo","4.0 out of 5 stars","For the most part they're good","Reviewed in the United States on February 1, 2024","I only have 2 problems with them (as of the day of receiving them):1. They're always loud. Even on the lowest volume setting I can have them on before they stop playing audio altogether (until I turn the sound back up)2. I wish there were left-right indicators on the earbuds themselves. I'm kinda dumb and can't really tell which earbud is supposed to go in which ear until I actually put them in.3. (Not really an issue but it's still something I'd like to talk about): the touch controls are definitely something to get used to. One thing I've also noticed is that you can only use the earbuds to adjust the volume of there's any media playing. Otherwise it won't work at all.4. The earbud case battery also drains a bit too quickly for comfort. Other than that, everything's fine so far.","4",""
"product1","all review","12","Mr. B","4.0 out of 5 stars","Everything is getting smaller, is it really worth it?","Reviewed in the United States on March 12, 2024","They work great. My only complaint is they are so small that every time I grab them I touch a different control and change something even while just trying to push them back in my ears. There are a number of control built into the head sets pieces. Once you start your machine most everything can be controlled from touching the ear pieces.","4",""
"product1","all review","13","Jackie Pronovost","4.0 out of 5 stars","Earbuds for small ear canals","Reviewed in the United States on February 22, 2024","I hate when I put in eabuds, and they proceed to fall out of my ears even when I use the smallest size. The true wire Earbuds have been in my ears since I took them out of the box and have not fallen out yet which is a record. I know I am going to enjoy listening to my podcasts and music with these earbuds because I won't have to keep looking for them or pausing whatever I am doing. I might get some things done quicker.","4",""
"product1","all review","14","xdgaf","4.0 out of 5 stars","Great for the price","Reviewed in the United States on March 5, 2024","My wife is always losing headphones so after losing multiple more expensive ones she uses these and loves them just as much and still hasn’t lost them. Battery life is good sound quality is decent only complaint is it is hard for the person to hear you on the other end of there is any background noise it starts to mesh together.","4",""
"product1","all review","15","Nicole w","4.0 out of 5 stars","UPDATE: my bad, they work fine.","Reviewed in the United States on January 19, 2024","so.... my bad. I did not have my PC bluetooth antenna hooked up properly. Which is strange bc i work with computers for a living. anyway, the ear buds work actually super well with my pc now and are my go to for zoom calls.good job guys and i apologize for the initial negative reviewignore previous review below.works great as earbuds for a phone, but do NOT try to use them with a PC or laptop. For whatever reason in this situation their range is axed to like 6"", and they cut in and out constantly if your head isn't right next to your computer. It makes zoom calls so insanely frustrating.","4",""
"product1","all review","16","Loren","4.0 out of 5 stars","Really solid choice for wireless earphones!","Reviewed in the United States on March 18, 2024","I use these EVERY DAY! I love them. The only issue I have is that sometimes the mic works seamlessly, sometimes, I have to disconnect and reconnect. But for the price, they're really solid!","4",""
"product1","all review","17","S. Westfall","4.0 out of 5 stars","Only connects to 1 device","Reviewed in the United States on February 27, 2024","A little disappointed, because another Bluetooth earbud device I have can connect to both my cellphone and my tablet at the same time, but this earbud does not. I have to disable Bluetooth on one device in order to be able to manually connect it to the other device.","4",""
"product1","all review","18","WAL IV","4.0 out of 5 stars","Sometimes have to re-pair","Reviewed in the United States on March 1, 2024","Sound is great.  Fit well in the ears/stay put pretty well.  Biggest issues - I have to re-pair with my device once in a while and the microphone for phone calls isn’t always clear for the listener.  Overall, I’m super happy and would buy these again.","4",""
"product1","all review","19","Nia","4.0 out of 5 stars","Pretty good","Reviewed in the United States on March 9, 2024","I think these AirPods are pretty Good the quality is pretty good they are very loud, the audio is clear enough for me. For the price they work very well.","4",""
"product1","all review","20","BT","4.0 out of 5 stars","Great value for the money","Reviewed in the United States on February 6, 2024","They are a great value.  Connect well and sound good.  The audio when speaking on the phone is not great, but sufficient, especially considering the cost.","4",""
"product1","all review","21","Ducci","4.0 out of 5 stars","Great for price.","Reviewed in the United States on February 11, 2024","Very good battery life and quality. Only thing it needs improvement on is the mic. Im very low and unclear sounding on the other end of a convo.","4",""
"product1","all review","22","Placeholder","4.0 out of 5 stars","Warranty","Reviewed in the United States on February 23, 2024","The buds are fine. And work well so far, but the ""Lifetime Warranty costs $49.99 and you can buy new ones for less than 1 months Warranty, LOL.","4",""
"product1","all review","23","braz","4.0 out of 5 stars","Mostly satisfactory","Reviewed in the United States on February 16, 2024","They sound good, they're comfortable, the price was right and I'll keep them.  The wireless charging feature is questionable ... they stalled out at 81%, never got any higher and generated considerable heat in the process, but I do appreciate the  clear status readout ... connected to a USB cable they charge up to 100% very quickly and deliver good sound for longer than I'm used to with earbuds","4",""
"product1","all review","24","MotherofChaos","4.0 out of 5 stars","Touchy touch feature","Reviewed in the United States on February 4, 2024","These area a great affordable set! They have excellent sound quality and an impressive battery life! My star deduction is for the touch feature.  Sometimes a wisp of hair or a strong breeze will cause an unexpected pause while other times I'm tapping the crap out of them and nothing happens.  This is definitely annoying.  BUT, for the price this is an excellent buy and I would definitely recommend for anyone on a budget!","4",""
"product1","all review","25","Rene A.","4.0 out of 5 stars","Good product compared to others","Reviewed in the United States on March 16, 2024","This is better compared to more expensive comparable products I bought. However, it only works on my Ipad and I can't use it on my Google phone.","4",""
"product1","all review","26","Nessa","4.0 out of 5 stars","Clear audio either a long battery life","Reviewed in the United States on March 1, 2024","I like the noise cancelation and that I can tap to end music or to play.  Is small and neat.  Audio is clear.","4",""
"product1","all review","27","Lck143","4.0 out of 5 stars","Great sound","Reviewed in the United States on March 7, 2024","Great sound, easy pairing and awesome battery life. Some trouble figuring out the operating of functions and unfortunately hurt my ears. But most earbuds do. Need to try a different type. Still using these just not for long periods.","4",""
"product1","all review","28","James Brian Copp","4.0 out of 5 stars","Pretty darn good for the price","Reviewed in the United States on February 25, 2024","These have already lasted longer than any other cheap pair I've purchased.  Better quality sound than I expected.  I love how you can just put them back in the little case and the little case recharges them.","4",""
"product1","all review","29","Esty Blatt","4.0 out of 5 stars","Poor noise cancelling","Reviewed in the United States on February 5, 2024","Great battery life and the case charges the earphones well. Good bluetooth and connects automatically to device when you open the case.These are cheap headphones in price and value.Poor noise canceling, people have a hard time hearing me if I'm outside or on the bus because of the background noise.If I'm speaking softly (if someone is sleeping in the other room) the earphones don't pick up the sound well.","4",""
"product1","all review","30","Katie","2.0 out of 5 stars","These work, but a couple of things you should know...","Reviewed in the United States on November 23, 2022","I bought these after dropping my Apple Air Pods in a bowl of marinade (FYI - They are not oil proof). I figured if I was going to be doing dumb things like that, I shouldn't be spending $150 on headphones. So I found these which were a bargain at $30.I've been using them for a couple of months now and I've noticed a couple of unusual things:1. Unlike Air Pods, these will not automatically stop playing if you take one of the ear buds out. The Apple ones will automatically pause whatever you are listening to if you take one out. A couple of times these did stop playing when I took them out, but most of the time they don't.2. I've discovered that occasionally, even if I pause what I'm listening to, take the headphones out and put them in their case, sometimes they will begin playing again all on their own, even though they are in the case. I realized that after I went back to pick up where I left off in my audio book and found that it had been playing for more than an hour and I had to go back and figure out where I was in the book.3. Occasionally, not all the time, after I pause what I'm listening to and take the headphones out, the music or audiobook will all of a sudden start up again but play out of my phone speaker, not the headphones. It's a little awkward at work when that happens, especially if I get up from my desk and walk away only to find when I come back that my phone has been playing my audio book out loud the whole time.4. Most annoying of all: Sometimes I will put the headphones on, and it will start playing really loud and will not allow me to turn it down. The headphones will say ""Volume Maximized"" while it's blasting my ear drums. I try to turn it down on my phone and see that the volume goes down, then the headphones bring it back to full volume and again scream at me ""Volume Maximized"". It's awful.The only good thing I can really say about these is that they were cheap. I would not recommend them to anyone now that I've had a chance to use them for a while. I'm probably going to start looking for an alternative.","2",""
"product1","all review","31","Sheila","2.0 out of 5 stars","These last two months max","Reviewed in the United States on February 24, 2024","Second set died 45 days after I received them as a replacement for the first set that did the same thing. They’ll drop connection in the middle of a speaking on the phone and don’t even think about trying to connect and put them in your ears after you’ve already picked up a call. They won’t connect properly mid call without having to switch several times between audio sources until they finally decide to work. I knew I should have just purchased a set of AirPods but I got these trying to save money. Well ya get what you pay for. And it’s too late to return them.  Junk.","2",""
"product1","all review","32","Dennis G","2.0 out of 5 stars","Waterproof? Not whatsoever....","Reviewed in the United States on November 7, 2023","I bought these as a replacement so I could have music for working out.I AM A SWEAT-ER IN THE GYM.... If you are too, try something else. I had a pair and after a week of cardio and weights, one ear bud went out in a blaze of glory by the volume shooting up in ear to the max before dying completely. Then, you put it in the case and it becomes a blackhole and sucks the energy out of the case and still doesn't charge. Thought it was a fluke, returned them and started fresh.New day! Similar results... A very annoying thing about these is when you put them in the case, they stay connected to your phone so if you're in the vicinity of your earbuds watching social media videos, they're silent and you don't know why. Then you have to unnecessarily deal with that.My 2nd pair just died and it's outside the return window. We'll see what happens. They're decent if you use them for everyday use and don't sweat in your cubicle. ""Value for the money"" is true.","2",""
"product1","all review","33","Brendan","2.0 out of 5 stars","Can't stop it from blasting music when I put them in","Reviewed in the United States on March 15, 2024","They work fine as headphones for music and calls although sometimes the controls can be accidentally activated by touching the headphones as you put them in.The big problem is that if I put them on without audio already playing on my phone, the headphones blast the first song in my Apple Music at full volume.  After two weeks, I can't figure out how to stop it, so I'm just going to have to get a different pair of earbuds.","2",""
"product1","all review","34","Juanito","2.0 out of 5 stars","Sound ok. Battery time not so good.","Reviewed in the United States on January 27, 2024","I always check the items that have most purchases and then by their score. I saw this item had both, so I went for it. I am a big music fan and listener and that's the main reason why I got this earbuds.. the sound quality it's ok, not great as I expected, I want my ears to rattle when I listen to a good bass song... Maybe I am being picky but these buds didn't meet my expectations.Battery time is also not so good. Only lasts for half a day when other earbuds out there lasts way more... Not a big fan, will not keep them long.Luckily for me I got other earbuds that are slightly better than this ones.","2","61QO+zw8PiL._SY88.jpg"
"product1","all review","35","Joonuper","2.0 out of 5 stars","Awful","Reviewed in the United States on September 2, 2023","I got these because the waterproof level indicated for them in the listing means they should be able to be used in the shower. About 2 weeks after I began wearing them the right earbud stopped taking a charge, and then stopped working altogether. The left earbud still works but 1) the sound quality is TERRIBLE - there is far too much bass in these. I guess that would be appealing for some types of music but I use them for podcasts and it made it so I couldn't understand so much of what was said. And 2) sometimes it starts turning up the volume for no reason and I can't get it to stop. Fun fact: when it reaches the maximum volume on your device, it starts screaming ""MAXIMUM VOLUME"" into your ear, at maximum volume, over and over and over as if that's any better than just listening to your music or podcast at maximum volume. And it doesn't stop until you turn your volume down, and in my case the earbud would continue to force the volume back up again on its own. I'd have to (in the middle of my shower) disconnect the earbud and reconnect it again in order to make it stop. My guess is that the 2nd earbud will stop working within the next month.","2",""
"product1","all review","36","Angii Hansen","2.0 out of 5 stars","Won't keep a charge","Reviewed in the United States on March 14, 2024","I bought one of these a couple of years ago and absolutely loved it and still use it all the time. This last one I bought will not keep a charge. I took it on vacation and couldn't get the ear pieces to charge. I plugged it in multiple times and it says it's charged at 100%, but I put the earbuds in and they keep saying low battery. 😒","2",""
"product1","all review","37","Sandor H","2.0 out of 5 stars","Broke pretty quickly","Reviewed in the United States on February 19, 2024","Loved these little things when I first got them. Decent sound, cool little charging case. Carried a charge for a decent amount of time.About 3 or 4 months in the right earbud stopped charging. It's dead and there appears to be no way to fix it. Now I only had one working bud, man. Not terrible for calls or podcasts but I paid for two, damn it.","2",""
"product1","all review","38","William D Medley","2.0 out of 5 stars","Good sound, bad microphone","Reviewed in the United States on March 8, 2024","Nice little head phones, ear buds, but the microphone seems to be spotty.  Good for listening to music, sound is find, but when use them with phone or computer phone, people on the other end say the mic is cutting in and out, even though sound is still good.  So not sure about using them for two way conversations.","2",""
